"[24]  Kuniyoshi  K,  Sakuramoto  H,  Yoshitake  K,  et  al.  Longitudi-","[26]  Parmeggiani  F,  De  Nadai  K,  Piovan  A,  et  al.  Optical  cohe-"
"nal  clinical  course  of  three  Japanese  patients  with  Leber  congenital","rence tomography imaging in the management of the Argus II retinal"
"amaurosis/early-onset  retinal  dystrophy  with  RDH12  mutation.  Doc","prosthesis system. Eur J Ophthalmol 2017 ; 27 : e16-e21."
"Ophthalmol 2014 ; 128 : 219-28.","[27]  Xu X, Fang Y, Yokoi T, et al. Posterior staphylomas in eyes with"
"[25]  Ilhan A, Yolcu  U,  Diner  O,  et  al.  Coexistence  of  posterior  sta-","retinitis pigmentosa without high myopia. Retina 2018 Apr 26. [Epub"
"phyloma,  retinitis  pigmentosa  and  moderate  myopia.  J  Coll  Physi-","ahead of print]."
"cians Surg Pak 2016 ; 26 : 70-1.",""
