"Aspect typique de macula bombée (en dôme).","a","","b"
"L’angiographie  est  normale ;  on  voit  néanmoins  une  légère  atrophie  de  l’épithélium  pigmentaire  paramaculaire  visible  à","","c",""
"l’effet  fenêtre  (a,  ﬂèche).  Sur  toutes  les  coupes  radiaires  passant  par  la  fovéola,  on  voit  la  voussure  antérieure  maculaire","","",""
"(b). Sur une de ces coupes (c), on voit bien que toutes les couches oculaires changent de courbure au niveau maculaire : la","","",""
"courbure du staphylome s’inﬂéchit vers l’avant au niveau scléral, chroroïdien et rétinien (têtes de ﬂèche). La rétine est nor-","","",""
"male et suit la courbure du staphylome ; il n’y a pas de décollement séreux, mais on voit une petite membrane épirétinienne","","",""
"associée (ﬂèche).","","",""
